{
  "$schema": "https://json-schema.org/draft/2020-12/schema",
  "title": "GitTaskBench Submission",
  "type": "object",
  "required": [
    "model",
    "commit_date",
    "completion",
    "pass"
  ],
  "properties": {
    "model": {
      "type": "string",
      "minLength": 1
    },
    "framework": {
      "type": [
        "string",
        "null"
      ]
    },
    "open_source": {
      "type": "boolean"
    },
    "commit_date": {
      "type": "string",
      "pattern": "^\\d{4}-\\d{2}-\\d{2}$"
    },
    "completion": {
      "type": "number",
      "minimum": 0,
      "maximum": 1
    },
    "pass": {
      "type": "number",
      "minimum": 0,
      "maximum": 1
    },
    "alpha": {
      "type": [
        "number",
        "null"
      ]
    },
    "cost": {
      "type": [
        "number",
        "null"
      ],
      "minimum": 0
    },
    "iterations": {
      "type": [
        "integer",
        "null"
      ],
      "minimum": 1
    },
    "config_url": {
      "type": "string"
    },
    "notes": {
      "type": "string"
    },
    "organization": {
      "type": "string"
    }
  },
  "additionalProperties": false
}